{
  "$schema": "../../../policies/schemas/proof-envelope.schema.json",
  "version": "1.0.0",
  "proofBytes": "AQIDBAUGBwgJCgsMDQ4PEBESExQVFhcYGRobHB0eHyAhIiMkJSYnKCkqKywtLi8wMTIzNDU2Nzg5Ojs8PT4/QEFCQ0RFRkdISUpLTE1OT1BRUlNUVVZXWFlaW1xdXl9gYWJjZGVmZ2hpamtsbW5vcHFyc3R1dnd4eXp7fH1+fw==",
  "verificationKeyBytes": "gIGCg4SFhoeIiYqLjI2Oj5CRkpOUlZaXmJmam5ydnp+goaKjpKWmp6ipqqusra6vsLGys7S1tre4ubq7vL2+v8DBwsPExcbHyMnKy8zNzs/Q0dLT1NXW19jZ2tvc3d7f4OHi4+Tl5ufo6err7O3u7/Dx8vP09fb3+Pn6+/z9/v8AAQ==",
  "productId": "chainborn-sample-app",
  "challenge": {
    "nonce": "MTIzNDU2Nzg5MGFiY2RlZg==",
    "issuedAt": "2026-02-07T13:00:00.000Z",
    "expiresAt": "2026-02-08T13:00:00.000Z"
  },
  "metadata": {
    "generatedAt": "2026-02-07T13:15:00.000Z",
    "proofServerVersion": "0.16.0",
    "tier": "professional",
    "features": [
      "api-access",
      "advanced-analytics",
      "priority-support"
    ],
    "customerId": "customer-abc-123"
  }
}
